{
  "$schema": "./node_modules/@cookiebench/benchmark-schema/schema.json",
  "name": "ketch",
  "iterations": 20,
  "cookieBanner": {
    "selectors": ["#ketch-modal"],
    "serviceHosts": ["global.ketchcdn.com", "cdn.ketchjs.com"],
    "waitForVisibility": true,
    "measureViewportCoverage": true,
    "expectedLayoutShift": true,
    "serviceName": "Ketch"
  },
  "internationalization": {
    "detection": "none",
    "stringLoading": "bundled"
  },
  "techStack": {
    "bundler": "unknown",
    "bundleType": "iife",
    "frameworks": [],
    "languages": ["javascript"],
    "packageManager": "unknown",
    "typescript": false
  },
  "source": {
    "isOpenSource": false,
    "license": "proprietary",
    "website": "https://www.ketch.com"
  },
  "company": {
    "name": "Ketch",
    "website": "https://ketch.com",
    "avatar": "https://cdn.brandfetch.io/idjo3EF7U_/w/400/h/400/theme/dark/icon.png?c=1dxbfHSJFAPEGdCLU4o5B"
  },
  "includes": {
    "backend": ["proprietary"],
    "components": ["javascript"]
  },
  "runProfile": {
    "cacheMode": "cold",
    "networkProfile": "none",
    "cpuSlowdownMultiplier": 1
  },
  "measurement": {
    "minSuccessfulIterations": 16,
    "maxFailureRate": 0.2,
    "stabilityThresholdCv": 15
  }
}
