{
  "$schema": "./node_modules/@cookiebench/benchmark-schema/schema.json",
  "name": "didomi",
  "iterations": 20,
  "cookieBanner": {
    "selectors": [
      ".didomi-popup-container",
      "#didomi-popup",
      ".didomi-notice-popup",
      ".didomi-host",
      "[data-testid=\"notice\"]"
    ],
    "serviceHosts": [
      "api.privacy-center.org",
      "sdk.privacy-center.org",
      "privacy-center.org"
    ],
    "waitForVisibility": true,
    "measureViewportCoverage": true,
    "expectedLayoutShift": true,
    "serviceName": "Didomi"
  },
  "internationalization": {
    "detection": "browser",
    "stringLoading": "bundled"
  },
  "techStack": {
    "bundler": "unknown",
    "bundleType": "bundled",
    "frameworks": ["react"],
    "languages": ["javascript"],
    "packageManager": "unknown",
    "typescript": false
  },
  "source": {
    "isOpenSource": false,
    "license": "proprietary",
    "website": "https://didomi.io"
  },
  "company": {
    "name": "Didomi",
    "website": "https://didomi.io",
    "avatar": "https://cdn.brandfetch.io/idVPEL4NcB/w/400/h/400/theme/dark/icon.jpeg?c=1dxbfHSJFAPEGdCLU4o5B"
  },
  "includes": {
    "backend": ["proprietary"],
    "components": ["javascript", "react"]
  },
  "runProfile": {
    "cacheMode": "cold",
    "networkProfile": "none",
    "cpuSlowdownMultiplier": 1
  },
  "measurement": {
    "minSuccessfulIterations": 16,
    "maxFailureRate": 0.2,
    "stabilityThresholdCv": 15
  }
}
