{
  "$schema": "./node_modules/@cookiebench/benchmark-schema/schema.json",
  "name": "c15t-react",
  "iterations": 20,
  "cookieBanner": {
    "selectors": [
      "[data-testid=\"cookie-banner-root\"]",
      ".c15t-banner",
      "[data-c15t-banner]",
      ".consent-banner",
      "[data-consent-banner]"
    ],
    "serviceHosts": [
      "c15t.com",
      "consent.io",
      "consent-io-europe-benchmarks.c15t.dev"
    ],
    "waitForVisibility": true,
    "measureViewportCoverage": true,
    "expectedLayoutShift": false,
    "serviceName": "C15T React"
  },
  "techStack": {
    "bundler": "rslib",
    "bundleType": ["esm", "cjs"],
    "frameworks": ["react"],
    "languages": ["typescript", "javascript"],
    "packageManager": "pnpm",
    "typescript": true
  },
  "source": {
    "github": "github.com/c15t/c15t",
    "isOpenSource": true,
    "license": "GPL-3.0-only",
    "npm": "@c15t/react@1.7.1",
    "website": "https://www.c15t.com"
  },
  "includes": {
    "backend": ["nodejs", "typescript"],
    "components": ["react", "javascript"]
  },
  "internationalization": {
    "detection": "browser",
    "stringLoading": "server"
  },
  "company": {
    "name": "c15t",
    "website": "https://c15t.com",
    "avatar": "https://zxlypdluowixfd7j.public.blob.vercel-storage.com/c15t-icon-z6gQxO0ogxWgY51dluWPhNfAoPyELT.png"
  },
  "tags": ["c15t"],
  "runProfile": {
    "cacheMode": "cold",
    "networkProfile": "none",
    "cpuSlowdownMultiplier": 1
  },
  "measurement": {
    "minSuccessfulIterations": 16,
    "maxFailureRate": 0.2,
    "stabilityThresholdCv": 15
  }
}
